<?xml version="1.0" encoding="UTF-8"?>
<dataset xmlns:xsi="http://www.w3.org/2001/XMLSchema-instance"
	xsi:noNamespaceSchemaLocation="../../../../../../../../../com.genebio.nextprot.datamodel/src/main/resources/dbxsd/dataset.xsd">
	
	<resources resource_id="106" cv_type_id="2"/>
	<publications resource_id="106" title="cendrillon" text_date="may-2009" cv_publication_type_id="10"
		datasource_id="4" 
		cv_date_precision_id="30" publication_date="2009-05-01 00:00:00" md5="002eec8d3752883c13ab9a1b064c1234"/>
	<pubauthors pubauthor_id="102" publication_id="106" 
		last_name="Luke" fore_name="Lucky" is_editor="0" rank="1" />
	<pubauthors pubauthor_id="103" publication_id="106" 
		last_name="Montana" fore_name="Toni" initials="T.M." is_editor="0" rank="2"/>		
		
		
	<resources resource_id="107" cv_type_id="2"/>
	<publications resource_id="107" title="what? what?" text_date="june-2010" cv_publication_type_id="10"
		datasource_id="4" 
		cv_date_precision_id="30" publication_date="2009-05-01 00:00:00" md5="002eec8d3752883c13ab9a1b064c1234"/>
	<pubauthors pubauthor_id="104" publication_id="107" 
		last_name="Solo" fore_name="Han" is_editor="0" rank="1" />
</dataset>