<?xml version="1.0" encoding="UTF-8"?>
<dataset xmlns:xsi="http://www.w3.org/2001/XMLSchema-instance"
	xsi:noNamespaceSchemaLocation="../../../../../../../../../com.genebio.nextprot.datamodel/src/main/resources/dbxsd/dataset.xsd">
	
		
	
	<!--  Antibody Master  -->
	<mapping_annotations annotation_id="51" reference_identifier_id="596889" mapped_identifier_id="11" cv_type_id="5" /> 
	
	<!-- 	 Antibody Iso  -->
	<mapping_annotations annotation_id="60" reference_identifier_id="16" mapped_identifier_id="11" cv_type_id="6" /> 
		
	<!--  Iso Master  -->	
	<mapping_annotations annotation_id="70" reference_identifier_id="596889" mapped_identifier_id="16" cv_type_id="4" /> 
	
	<mapping_positions annotation_id="60" position_id="20" first_pos="1" last_pos="1000"/>
	
	<!-- 	ISO 	-->
	<sequence_identifiers identifier_id="16" cv_type_id="1" unique_name="NX_P12345-1"/>

	<!-- 	ANTIBODY 	-->
	<sequence_identifiers identifier_id="11" cv_type_id="6" unique_name="NX_HPA004932" />

	<!-- 	Master 	-->
	<sequence_identifiers identifier_id="596889" cv_type_id="1" unique_name="NX_P12345" db_xref_id="3434634"/>

	
</dataset>	